{
  "id": "20261027-1447-speaking-observatory-and-homes",
  "title": "Speaking practice (hard): Observatory visitor centre and homes",
  "format": "toefl-ibt-2026",
  "mode": "practice",
  "created": "2026-10-27",
  "author": "toefl-claude-test-generator",
  "difficulty": "hard",
  "description": "Listen and repeat with an observatory visitor centre coordinator (long sentences built on articles, each/number-of agreement, collocations, passives and relative clauses); an interview on homes and living spaces that requires describing, past narration, comparing and justifying a choice, and explaining and predicting a trend.",
  "tags": [
    "practice",
    "speaking",
    "listen_and_repeat",
    "interview"
  ],
  "sections": [
    {
      "id": "speaking",
      "modules": {
        "m1": {
          "tasks": [
            {
              "id": "s-repeat",
              "type": "listen_and_repeat",
              "setting": "You are starting work at the visitor centre of a hilltop observatory. Listen to the visitor coordinator and repeat exactly what you hear.",
              "items": [
                {
                  "id": "i1",
                  "text": "The dome opens at dusk.",
                  "voice": "female_3",
                  "response_sec": 8
                },
                {
                  "id": "i2",
                  "text": "Each of the telescopes has its own cover.",
                  "voice": "female_3",
                  "response_sec": 8
                },
                {
                  "id": "i3",
                  "text": "The number of visitors has doubled since the new exhibition opened.",
                  "voice": "female_3",
                  "response_sec": 9
                },
                {
                  "id": "i4",
                  "text": "If the sky is cloudy, we show a short film about the planets instead.",
                  "voice": "female_3",
                  "response_sec": 10
                },
                {
                  "id": "i5",
                  "text": "The mirror in the largest telescope, which was polished by hand, has to be cleaned once a year.",
                  "voice": "female_3",
                  "response_sec": 11
                },
                {
                  "id": "i6",
                  "text": "Guests who've booked the late tour should be reminded that the car park closes at midnight.",
                  "voice": "female_3",
                  "response_sec": 12
                },
                {
                  "id": "i7",
                  "text": "The comet that the staff had been tracking for weeks was finally visible to the naked eye on Friday.",
                  "voice": "female_3",
                  "response_sec": 12
                }
              ]
            },
            {
              "id": "s-interview",
              "type": "interview",
              "topic": "Homes and the places we live",
              "voice": "interviewer",
              "intro": "Hi, and thanks for joining me. I'm talking to people about their homes and how the places we live shape our everyday lives.",
              "answer_sec": 45,
              "questions": [
                {
                  "id": "q1",
                  "text": "To start, could you describe the place where you live now and tell me what you like most about it?"
                },
                {
                  "id": "q2",
                  "text": "Tell me about a time when you moved to a new home, redesigned a room, or helped someone settle into a new place. What happened, and how did it turn out?"
                },
                {
                  "id": "q3",
                  "text": "Some people would rather live in a small flat in the city centre, while others prefer a larger house further from the city. Compare the two options, and explain which one you would choose and why."
                },
                {
                  "id": "q4",
                  "text": "In many countries, young adults are living with their parents or sharing homes with friends for longer than in the past. Why do you think this is happening, and how might it change the way people live in twenty years?"
                }
              ]
            }
          ]
        }
      }
    }
  ]
}