{
  "id": "20261027-1442-speaking-library-and-careers",
  "title": "Speaking practice (hard): University library and choosing a career",
  "format": "toefl-ibt-2026",
  "mode": "practice",
  "created": "2026-10-27",
  "author": "toefl-claude-test-generator",
  "difficulty": "hard",
  "description": "Listen and repeat at a university library help desk (dense with articles and relative clauses); an interview on work and choosing a career that requires comparing, justifying and speculating.",
  "tags": [
    "practice",
    "speaking",
    "listen_and_repeat",
    "interview"
  ],
  "sections": [
    {
      "id": "speaking",
      "modules": {
        "m1": {
          "tasks": [
            {
              "id": "s-repeat",
              "type": "listen_and_repeat",
              "setting": "You are starting work as an assistant at a university library help desk. Listen to the head librarian and repeat exactly what you hear.",
              "items": [
                {
                  "id": "i1",
                  "text": "The help desk opens at eight.",
                  "voice": "male_2",
                  "response_sec": 8
                },
                {
                  "id": "i2",
                  "text": "Students can borrow up to twenty books at a time.",
                  "voice": "male_2",
                  "response_sec": 8
                },
                {
                  "id": "i3",
                  "text": "We'll show you how to renew a loan and reserve a study room.",
                  "voice": "male_2",
                  "response_sec": 9
                },
                {
                  "id": "i4",
                  "text": "If a book is already checked out, you can place a hold on it online.",
                  "voice": "male_2",
                  "response_sec": 10
                },
                {
                  "id": "i5",
                  "text": "The rare books on the top floor can't leave the building, but students may read them in the reading room.",
                  "voice": "male_2",
                  "response_sec": 11
                },
                {
                  "id": "i6",
                  "text": "Anyone who hasn't returned a laptop by the end of the day will have their borrowing rights suspended for a week.",
                  "voice": "male_2",
                  "response_sec": 12
                },
                {
                  "id": "i7",
                  "text": "When a student asks for an article that we don't have, you should explain how the interlibrary loan service works.",
                  "voice": "male_2",
                  "response_sec": 12
                }
              ]
            },
            {
              "id": "s-interview",
              "type": "interview",
              "topic": "Work and choosing a career",
              "voice": "interviewer",
              "intro": "Hello, and thanks for taking part. I'm interviewing people about work, and about how they decide what kind of career they want.",
              "answer_sec": 45,
              "questions": [
                {
                  "id": "q1",
                  "text": "To start, what kind of job or career are you hoping to have in the future, and what first made you interested in it?"
                },
                {
                  "id": "q2",
                  "text": "Tell me about a time when you had to work with other people to finish a difficult task. What was your role, and what did you learn from the experience?"
                },
                {
                  "id": "q3",
                  "text": "Some people would rather have a job with a high salary, while others would choose work they enjoy even if it pays less. Compare these two choices and explain which one makes more sense to you."
                },
                {
                  "id": "q4",
                  "text": "Many experts predict that technology will replace a large number of today's jobs within twenty years. How do you think this will change the way young people should prepare for their careers? Please explain your view."
                }
              ]
            }
          ]
        }
      }
    }
  ]
}